id,area_desc,event,severity,certainty,urgency,headline,description,instruction,sent,effective,expires,status,message_type,sender_name,web,geometry_type
urn:oid:2.49.0.1.840.0.83857f6df4807089a8e2c821432423a75cba4fe6.001.1,Coastal waters from Fernandina Beach to St. Augustine FL out 20 NM; Waters from Fernandina Beach to St. Augustine FL from 20 to 60 NM,Marine Weather Statement,Minor,Observed,Expected,Marine Weather Statement issued August 14 at 2:19PM EDT by NWS Jacksonville FL,"A Marine Weather Statement has been issued for the following areas...
Coastal waters from Fernandina Beach to St. Augustine FL out 20
NM...
Waters from Fernandina Beach to St. Augustine FL from 20 to 60
NM...

At 219 PM EDT, Doppler radar indicated a strong thunderstorm, capable
of producing winds to around 30 knots. This thunderstorm was located
over Mayport, or 31 nm north of Saint Augustine, moving east at 20
knots.","Mariners can expect gusty winds to around 30 knots, locally higher
waves, and lightning strikes. Boaters should seek safe harbor
immediately until this storm passes.",2025-08-14 18:19:00+00:00,2025-08-14 18:19:00+00:00,2025-08-14 19:15:00+00:00,Actual,Alert,NWS Jacksonville FL,http://www.weather.gov,Polygon
urn:oid:2.49.0.1.840.0.9a6138e4b22b129d29a171621c9df1c2b30b3cd4.001.1,"Cumberland, ME; York, ME",Severe Thunderstorm Warning,Severe,Observed,Immediate,Severe Thunderstorm Warning issued August 14 at 2:18PM EDT until August 14 at 3:00PM EDT by NWS Gray ME,"SVRGYX

The National Weather Service in Gray Maine has issued a

* Severe Thunderstorm Warning for...
Northeastern York County in southwestern Maine...
Southwestern Cumberland County in southwestern Maine...

* Until 300 PM EDT.

* At 217 PM EDT, a severe thunderstorm was located over Hollis, or 8
miles northeast of Alfred, moving east at 25 mph.

HAZARD...60 mph wind gusts and half dollar size hail.

SOURCE...Radar indicated.

IMPACT...Hail damage to vehicles is expected. Expect wind damage
to roofs, siding, and trees.

* Locations impacted include...
South Portland, Scarborough, Buxton, Biddeford, Dayton, Old Orchard
Beach, Waterboro, Cape Elizabeth, Hollis, Saco, Limington, Lyman,
Gorham, Arundel, Kennebunkport, Westbrook, Portland, and Standish.

This includes the following highways...
Interstate 295 between mile markers 1 and 3.
Interstate 95 between mile markers 30 and 46.

This also includes...
Fortunes Rock Beach, Higgins Beach, Crescent Beach State Park, and
Scarborough Beach State Park.","For your protection move to an interior room on the lowest floor of a
building.",2025-08-14 18:18:00+00:00,2025-08-14 18:18:00+00:00,2025-08-14 19:00:00+00:00,Actual,Alert,NWS Gray ME,http://www.weather.gov,Polygon
urn:oid:2.49.0.1.840.0.14c6556235d7dfa26954b404c12081129a1c6804.001.1,"Franklin, LA; Madison, LA; Tensas, LA; Claiborne, MS; Jefferson, MS; Warren, MS",Severe Thunderstorm Warning,Severe,Observed,Immediate,Severe Thunderstorm Warning issued August 14 at 1:14PM CDT until August 14 at 2:15PM CDT by NWS Jackson MS,"SVRJAN

The National Weather Service in Jackson has issued a

* Severe Thunderstorm Warning for...
Tensas Parish in northeastern Louisiana...
Southern Madison Parish in northeastern Louisiana...
Southeastern Franklin Parish in northeastern Louisiana...
Southwestern Warren County in west central Mississippi...
Central Claiborne County in southwestern Mississippi...
Northwestern Jefferson County in southwestern Mississippi...

* Until 215 PM CDT.

* At 114 PM CDT, severe thunderstorms were located along a line
extending from near Somerset to near Lake Bruin, moving east at 20
mph.

HAZARD...60 mph wind gusts and quarter size hail.

SOURCE...Radar indicated.

IMPACT...Hail damage to vehicles is expected. Expect wind damage
to roofs, siding, and trees.

* Severe thunderstorms will be near...
St. Joseph, Newellton, Lake Bruin, and Somerset around 120 PM CDT.
Afton around 130 PM CDT.
Port Gibson around 155 PM CDT.","For your protection move to an interior room on the lowest floor of a
building.",2025-08-14 18:14:00+00:00,2025-08-14 18:14:00+00:00,2025-08-14 19:15:00+00:00,Actual,Alert,NWS Jackson MS,http://www.weather.gov,Polygon
urn:oid:2.49.0.1.840.0-KEEPALIVE-58848,Montgomery,Test Message,Unknown,Unknown,Unknown,,Monitoring message only. Please disregard.,Monitoring message only. Please disregard.,2025-08-14 18:13:34+00:00,2025-08-14 18:13:34+00:00,2025-08-14 18:23:34+00:00,Test,Alert,NWS,http://www.weather.gov,
urn:oid:2.49.0.1.840.0.4b5a3a698ad98b276486e532c0d64906df632905.001.1,Lincoln; Union; Jackson; Ouachita,Special Weather Statement,Moderate,Observed,Expected,Special Weather Statement issued August 14 at 1:10PM CDT by NWS Shreveport LA,"At 110 PM CDT, Doppler radar was tracking an area of strong
thunderstorms 9 miles southwest of Claiborne, moving east at 20 mph.

HAZARD...Wind gusts up to 40 mph and half inch size hail.

SOURCE...Radar indicated.

IMPACT...Gusty winds could knock down tree limbs and blow around
unsecured objects. Minor damage to outdoor objects is possible.

Locations impacted include...
Monroe, Ruston, Claiborne, West Monroe, Brownsville-Bawcom,
Brownsville-Bawcomville, Swartz, Farmerville, Richwood,
Sterlington, Choudrant, Marion, Chatham, Eros, Downsville, Drew,
Cheniere, Folksville, Eureka and Rocky Branch.","Monitor the weather situation closely and be alert for threatening
weather conditions.

This storm may intensify, so be certain to monitor local radio
stations and available television stations for additional
information and possible warnings from the National Weather Service.

Frequent cloud to ground lightning is occurring with this storm.
Lightning can strike 10 miles away from a thunderstorm. Seek a safe
shelter inside a building or vehicle.",2025-08-14 18:10:00+00:00,2025-08-14 18:10:00+00:00,2025-08-14 19:30:00+00:00,Actual,Alert,NWS Shreveport LA,http://www.weather.gov,Polygon
urn:oid:2.49.0.1.840.0.ce39b6c6da0428d1a3b21fac73b6a7482484f4b7.001.1,Coastal waters from Cape Fear NC to Little River Inlet SC out 20 nm; Coastal waters from Little River Inlet to Murrells Inlet SC out 20 nm; Coastal waters from Murrells Inlet to South Santee River SC out 20 nm; Waters from Little River Inlet to Murrells Inlet SC from 20 to 40 nm; Waters from Murrells Inlet NC to South Santee River SC from 20 to 40 nm,Special Marine Warning,Severe,Likely,Immediate,Special Marine Warning issued August 14 at 2:10PM EDT until August 14 at 3:15PM EDT by NWS Wilmington NC,"SMWILM

The National Weather Service in Wilmington has issued a

* Special Marine Warning for...
Coastal waters from Cape Fear NC to Little River Inlet SC out 20
nm...
Coastal waters from Little River Inlet to Murrells Inlet SC out 20
nm...
Coastal waters from Murrells Inlet to South Santee River SC out 20
nm...
Waters from Little River Inlet to Murrells Inlet SC from 20 to 40
nm...
Waters from Murrells Inlet NC to South Santee River SC from 20 to
40 nm...

* Until 315 PM EDT.

* At 209 PM EDT, strong thunderstorms were located along a line
extending from 9 nm northwest of Murrells Inlet to near DeBordieu
Colony, moving east at 45 knots.

HAZARD...Wind gusts 34 knots or greater.

SOURCE...Radar.

IMPACT...Small craft could be damaged in briefly higher winds and
suddenly higher waves.

* Locations impacted include...
Ten Mile Reef, Pawleys Island, Murrells Inlet Sea Buoy, Atlantic
Ledge, Little River Offshore Reef, Myrtle Beach Rock, A R 445,
Paradise Reef, Little River Sea Buoy, Jungle, Cherry Grove Inlet,
Little River Reef, Lockwood Folly Inlet Sea Buoy, Sherman Wreck,
Belky Bear, Litchfield Beach, Bill Perry Junior Reef, Shallotte
River Inlet Sea Buoy, North Inlet Reef, and Bp 25 Liberty Ship
Wreck.","Boaters should seek safe harbor immediately until these storms pass.
If caught on the open water, prepare for deteriorating conditions.
Make sure you and your crew are wearing properly fitted life jackets.

Very heavy rain is occurring in these storms. Visibility could fall
to near zero as they pass.",2025-08-14 18:10:00+00:00,2025-08-14 18:10:00+00:00,2025-08-14 19:15:00+00:00,Actual,Alert,NWS Wilmington NC,http://www.weather.gov,Polygon
urn:oid:2.49.0.1.840.0.39b2fdf2f00f6c94818c18b744856db2400e4423.001.1,Washington; Inland Bay; Coastal Bay,Special Weather Statement,Moderate,Observed,Expected,Special Weather Statement issued August 14 at 2:07PM EDT by NWS Tallahassee FL,"At 206 PM EDT/106 PM CDT/, Doppler radar was tracking strong
thunderstorms along a line extending from 11 miles southeast of
Vernon to 10 miles north of Lynn Haven to 14 miles north of Hiland
Park. Movement was southeast at 10 mph.

HAZARD...Wind gusts up to 40 mph.

SOURCE...Radar indicated.

IMPACT...Gusty winds could knock down tree limbs and blow around
unsecured objects.

Locations impacted include...
Wausau, Nixon, Bayhead, Southport, Fountain, Singer Road, Recota
Beach, Saunders, Greenhead, Camp Flowers, Gainer Spring, Bennett,
Youngstown, Cairo, Porter Lake, Vicksburg, Spring Hollow, Riverside,
and Betts.","If outdoors, consider seeking shelter inside a building.",2025-08-14 18:07:00+00:00,2025-08-14 18:07:00+00:00,2025-08-14 18:30:00+00:00,Actual,Alert,NWS Tallahassee FL,http://www.weather.gov,Polygon
urn:oid:2.49.0.1.840.0-KEEPALIVE-6485,Montgomery,Test Message,Unknown,Unknown,Unknown,,Monitoring message only. Please disregard.,Monitoring message only. Please disregard.,2025-08-14 18:03:34+00:00,2025-08-14 18:03:34+00:00,2025-08-14 18:13:34+00:00,Test,Alert,NWS,http://www.weather.gov,
urn:oid:2.49.0.1.840.0.8c47da1036cd1bf9905813d803841a106db0cffd.001.1,Bourbon; Crawford; Cherokee; Benton; Morgan; Vernon; St. Clair; Hickory; Camden; Barton; Cedar; Polk; Dallas; Jasper; Dade; Greene; Newton; Lawrence; Christian; McDonald; Barry; Stone; Taney,Heat Advisory,Moderate,Likely,Expected,Heat Advisory issued August 14 at 1:03PM CDT until August 18 at 8:00PM CDT by NWS Springfield MO,"* WHAT...Heat index values up to 106 expected.

* WHERE...Portions of southeast Kansas and central, southwest, and
west central Missouri.

* WHEN...From noon Friday to 8 PM CDT Monday.

* IMPACTS...Hot temperatures and high humidity may cause heat
illnesses.","Drink plenty of fluids, stay in an air-conditioned room, stay out of
the sun, and check up on relatives and neighbors.

Take extra precautions when outside. Wear lightweight and loose
fitting clothing. Try to limit strenuous activities to early morning
or evening. Take action when you see symptoms of heat exhaustion and
heat stroke.

To reduce risk during outdoor work, the Occupational Safety and
Health Administration recommends scheduling frequent rest breaks in
shaded or air conditioned environments. Anyone overcome by heat
should be moved to a cool and shaded location. Heat stroke is an
emergency! Call 9 1 1.",2025-08-14 18:03:00+00:00,2025-08-14 18:03:00+00:00,2025-08-15 18:15:00+00:00,Actual,Alert,NWS Springfield MO,http://www.weather.gov,
urn:oid:2.49.0.1.840.0.dbf1f1160a05b2fa6c8982ef5ad163646d2c98f5.001.1,Suwannee; Baker; Inland Nassau; Union; Bradford; Gilchrist; Inland Flagler; Eastern Hamilton; Coastal Nassau; Coastal Duval; Eastern Clay; Eastern Alachua; Eastern Putnam; Coastal Flagler; Eastern Marion; Western Hamilton; Trout River; Western Clay; Northeast Coastal St. Johns; Western Alachua; Western Putnam; Central Marion; Northern Columbia; South Central Duval; Southeast Coastal St. Johns; Western Marion; Southeastern Columbia; Western Duval; Northern Inland St. Johns; Southwestern Columbia; Southern Inland St. Johns; Western St. Johns; Wayne; Pierce; Brantley; Inland Glynn; Coastal Glynn; Echols; Clinch; Inland Camden; Coastal Camden; Northern Ware; Northeastern Charlton; Southern Ware; Western Charlton,Heat Advisory,Moderate,Likely,Expected,Heat Advisory issued August 14 at 2:00PM EDT until August 14 at 7:00PM EDT by NWS Jacksonville FL,"* WHAT...Heat index values up to 111.

* WHERE...Portions of northeast and northern Florida and southeast
Georgia.

* WHEN...Until 7 PM EDT this evening.

* IMPACTS...Hot temperatures and high humidity may cause heat
illnesses.","Drink plenty of fluids, stay in an air-conditioned room, stay out of
the sun, and check up on relatives and neighbors.

To reduce risk during outdoor work, the Occupational Safety and
Health Administration recommends scheduling frequent rest breaks in
shaded or air conditioned environments. Anyone overcome by heat
should be moved to a cool and shaded location. Heat stroke is an
emergency! Call 9 1 1.",2025-08-14 18:00:00+00:00,2025-08-14 18:00:00+00:00,2025-08-14 23:00:00+00:00,Actual,Update,NWS Jacksonville FL,http://www.weather.gov,
urn:oid:2.49.0.1.840.0.77165732ef756a6adfac41960c03c504250e0623.001.1,Wayne,Special Weather Statement,Moderate,Observed,Expected,Special Weather Statement issued August 14 at 1:00PM CDT by NWS Mobile AL,"At 100 PM CDT, Doppler radar was tracking a strong thunderstorm near
Waynesboro, moving east at 5 mph.

HAZARD...Wind gusts up to 40 mph and penny size hail.

SOURCE...Radar indicated.

IMPACT...Gusty winds could knock down tree limbs and blow around
unsecured objects. Minor damage to outdoor objects is
possible.

Locations impacted include...
Waynesboro and Buckatunna.","If outdoors, consider seeking shelter inside a building.",2025-08-14 18:00:00+00:00,2025-08-14 18:00:00+00:00,2025-08-14 18:45:00+00:00,Actual,Alert,NWS Mobile AL,http://www.weather.gov,Polygon
urn:oid:2.49.0.1.840.0.1a9976a3a855d3c0d1d7f1d012cf6e442507902b.001.1,Oldham,Heat Advisory,Moderate,Likely,Expected,Heat Advisory issued August 14 at 12:59PM CDT until August 14 at 9:00PM CDT by NWS Amarillo TX,"* WHAT...Temperatures up to 106 degrees.

* WHERE...Oldham County.

* WHEN...Until 9 PM CDT this evening.

* IMPACTS...Hot temperatures may cause heat illnesses.

* ADDITIONAL DETAILS...This Heat Advisory is primarily for the
Canadian River Valley in Oldham county, including Boys Ranch.","Drink plenty of fluids, stay in an air-conditioned room, stay out of
the sun, and check up on relatives and neighbors.

Take extra precautions when outside. Wear lightweight and loose
fitting clothing. Try to limit strenuous activities to early morning
or evening. Take action when you see symptoms of heat exhaustion and
heat stroke.",2025-08-14 17:59:00+00:00,2025-08-14 17:59:00+00:00,2025-08-15 01:00:00+00:00,Actual,Alert,NWS Amarillo TX,http://www.weather.gov,
urn:oid:2.49.0.1.840.0.1a9976a3a855d3c0d1d7f1d012cf6e442507902b.002.1,Palo Duro Canyon,Heat Advisory,Moderate,Likely,Expected,Heat Advisory issued August 14 at 12:59PM CDT until August 14 at 9:00PM CDT by NWS Amarillo TX,"* WHAT...Temperature up to 105 degrees expected.

* WHERE...Palo Duro Canyon County.

* WHEN...Until 9 PM CDT this evening.

* IMPACTS...Hot temperatures combined with humidity may cause heat
illnesses.

* ADDITIONAL DETAILS...Terrain features present in the canyon may
see temperatures exceed 105 degrees down near the canyon floor.","Drink plenty of fluids, stay in an air-conditioned room, stay out of
the sun, and check up on relatives and neighbors.

Take extra precautions when outside. Wear lightweight and loose
fitting clothing. Try to limit strenuous activities to early morning
or evening. Take action when you see symptoms of heat exhaustion and
heat stroke.",2025-08-14 17:59:00+00:00,2025-08-14 17:59:00+00:00,2025-08-15 01:00:00+00:00,Actual,Update,NWS Amarillo TX,http://www.weather.gov,
urn:oid:2.49.0.1.840.0.67ac69f5d2d742ed61f202fbab8168d8a11507d2.001.1,"East Carroll, LA; Madison, LA; Issaquena, MS; Warren, MS",Severe Thunderstorm Warning,Severe,Observed,Immediate,Severe Thunderstorm Warning issued August 14 at 12:55PM CDT until August 14 at 2:00PM CDT by NWS Jackson MS,"SVRJAN

The National Weather Service in Jackson has issued a

* Severe Thunderstorm Warning for...
Southeastern East Carroll Parish in northeastern Louisiana...
Northeastern Madison Parish in northeastern Louisiana...
Northern Warren County in west central Mississippi...
Southern Issaquena County in west central Mississippi...

* Until 200 PM CDT.

* At 1255 PM CDT, a severe thunderstorm was located near Eagle Bend,
or 11 miles east of Tallulah, moving east at 20 mph.

HAZARD...60 mph wind gusts and quarter size hail.

SOURCE...Radar indicated.

IMPACT...Hail damage to vehicles is expected. Expect wind damage
to roofs, siding, and trees.

* This severe thunderstorm will be near...
Vicksburg around 100 PM CDT.
Redwood around 110 PM CDT.
Oak Ridge around 125 PM CDT.","For your protection move to an interior room on the lowest floor of a
building.",2025-08-14 17:55:00+00:00,2025-08-14 17:55:00+00:00,2025-08-14 19:00:00+00:00,Actual,Alert,NWS Jackson MS,http://www.weather.gov,Polygon
urn:oid:2.49.0.1.840.0.456673917f1f774e9c4f439e3937fc7aad9cfbe6.001.1,Pamlico Sound; Neuse and Bay Rivers; S of Ocracoke Inlet NC to Cape Lookout NC out to 20 nm,Special Marine Warning,Severe,Likely,Immediate,Special Marine Warning issued August 14 at 1:55PM EDT until August 14 at 3:00PM EDT by NWS Newport/Morehead City NC,"SMWMHX

The National Weather Service in Newport has issued a

* Special Marine Warning for...
Neuse and Bay Rivers...
Pamlico Sound...
S of Ocracoke Inlet NC to Cape Lookout NC out to 20 nm...

* Until 300 PM EDT.

* At 155 PM EDT, strong thunderstorms were located along a line
extending from near The Vicinity Of South River to near The
Vicinity Of Cedar Island, moving northeast at 5 knots.

HAZARD...Wind gusts 34 knots or greater.

SOURCE...Radar.

IMPACT...Small craft could be damaged in briefly higher winds and
suddenly higher waves.

* Locations impacted include...
Oriental, The Mouth Of The Neuse River, Cedar Island, and The
Vicinity Of Cedar Island.","Move to safe harbor until hazardous weather passes.

Frequent lightning is occurring with these storms. If caught on the
open water stay below deck if possible, keep away from ungrounded
metal objects.",2025-08-14 17:55:00+00:00,2025-08-14 17:55:00+00:00,2025-08-14 19:00:00+00:00,Actual,Alert,NWS Newport/Morehead City NC,http://www.weather.gov,Polygon
urn:oid:2.49.0.1.840.0-KEEPALIVE-12446,Montgomery,Test Message,Unknown,Unknown,Unknown,,Monitoring message only. Please disregard.,Monitoring message only. Please disregard.,2025-08-14 17:53:34+00:00,2025-08-14 17:53:34+00:00,2025-08-14 18:03:34+00:00,Test,Alert,NWS,http://www.weather.gov,
urn:oid:2.49.0.1.840.0.ff444953b87dd30ebe81d4ee0e5c7ac7160402ed.001.1,"Brown, SD",Flood Warning,Severe,Observed,Immediate,Flood Warning issued August 14 at 12:52PM CDT by NWS Aberdeen SD,"...The Flood Warning continues for the following rivers in South
Dakota...

James River at Columbia affecting Brown County.

.For sites with a river forecast, the forecast includes
precipitation through the next 24 hours. Any future precipitation
could affect the forecasts.

* WHAT...Minor flooding is occurring and minor flooding is forecast.

* WHERE...James River at Columbia.

* WHEN...Until further notice.

* IMPACTS...At 13.0 feet, flooding of the lower lying agricultural
areas begins.
At 15.0 feet, significant amounts of agricultural lands are flooded.

* ADDITIONAL DETAILS...
- At 12:00 PM CDT Thursday the stage was 14.7 feet.
- Recent Activity...The maximum river stage in the 24 hours
ending at 12:00 PM CDT Thursday was 14.8 feet.
- Forecast...The river is expected to fall to 14.1 feet
Thursday, August 21.
- Flood stage is 13.0 feet.
- http://www.weather.gov/safety/flood","Turn around, don't drown when encountering flooded roads. Most flood
deaths occur in vehicles.

Caution is urged when walking near riverbanks.

Additional information is available at www.weather.gov/abr.

The next statement will be issued by Friday evening at 900 PM CDT.",2025-08-14 17:52:00+00:00,2025-08-14 17:52:00+00:00,2025-08-16 02:00:00+00:00,Actual,Update,NWS Aberdeen SD,http://www.weather.gov,Polygon
urn:oid:2.49.0.1.840.0.594f9d205ca8187035cc2ae1bcf8bcd2faf5d5c4.001.1,Franklin; Tensas,Special Weather Statement,Moderate,Observed,Expected,Special Weather Statement issued August 14 at 12:52PM CDT by NWS Jackson MS,"At 1252 PM CDT, Doppler radar was tracking a strong thunderstorm near
Newlight, or 13 miles northwest of St. Joseph, moving east at 15 mph.

HAZARD...Wind gusts up to 40 mph and nickel size hail.

SOURCE...Radar indicated.

IMPACT...Gusty winds could knock down tree limbs and blow around
unsecured objects. Minor hail damage to vegetation is
possible.

This strong thunderstorm will be near...
Newellton and Lake Bruin around 100 PM CDT.","If outdoors, consider seeking shelter inside a building.

Frequent cloud to ground lightning is occurring with this storm.
Lightning can strike 10 miles away from a thunderstorm. Seek a safe
shelter inside a building or vehicle.",2025-08-14 17:52:00+00:00,2025-08-14 17:52:00+00:00,2025-08-14 18:45:00+00:00,Actual,Alert,NWS Jackson MS,http://www.weather.gov,Polygon
urn:oid:2.49.0.1.840.0.60d2fa7d0f1d2ad47054f65aa2719fba95f31e2c.001.1,"Sierra, NM",Flood Advisory,Minor,Likely,Expected,Flood Advisory issued August 14 at 11:52AM MDT until August 14 at 1:45PM MDT by NWS El Paso Tx/Santa Teresa NM,"* WHAT...Arroyo and small stream flooding caused by excessive
rainfall is expected.

* WHERE...A portion of south central New Mexico, including the
following county, Sierra.

* WHEN...Until 145 PM MDT.

* IMPACTS...Rises in small streams and normally dry arroyos.

* ADDITIONAL DETAILS...
- At 1152 AM MDT, Doppler radar indicated heavy rain due to
thunderstorms. This will cause arroyo and small stream
flooding. Between 1 and 1.5 inches of rain have fallen.
- Percha Creek is the most likely place to experience minor
flooding.
Additional rainfall of up to 0.5 to 1 inch is expected over
the area. This additional rain will result in minor flooding.
- Some locations that may experience flooding include...
Hillsboro, Emory Pass and Kingston.
- http://www.weather.gov/safety/flood","Turn around, don't drown when encountering flooded roads. Most flood
deaths occur in vehicles.

In hilly terrain there are numerous low water crossings which are
potentially dangerous in heavy rain. Do not attempt to cross flooded
roads. Find an alternate route.

Remain alert for flooding even in locations not receiving rain.
Arroyos, streams, and rivers can become raging killer currents in a
matter of minutes, even from distant rainfall.

Flooding is occurring or is imminent. It is important to know where
you are relative to streams, rivers, or creeks which can become
killers in heavy rains. Campers and hikers should avoid streams or
creeks.",2025-08-14 17:52:00+00:00,2025-08-14 17:52:00+00:00,2025-08-14 19:45:00+00:00,Actual,Alert,NWS El Paso Tx/Santa Teresa NM,http://www.weather.gov,Polygon
urn:oid:2.49.0.1.840.0.6cdaab655657839c7e3d2cd8d4993d282e48b4a6.001.1,Stephens Passage,Marine Weather Statement,Minor,Observed,Expected,Marine Weather Statement issued August 14 at 9:50AM AKDT by NWS Juneau AK,"Fallen trees and other debris have been reported in Mendenhall River
and may wash downstream as a result of the Glacier Outburst Flood.
Mariners within Stephens Passage, particularly near Mendenhall
River, should be advised and exercise caution.",,2025-08-14 17:51:00+00:00,2025-08-14 17:50:00+00:00,2025-08-14 23:45:00+00:00,Actual,Alert,NWS Juneau AK,http://www.weather.gov,Polygon
urn:oid:2.49.0.1.840.0.e94cb07b2689a0614062f5bb04c21d8927dcce88.001.1,Palo Duro Canyon,Heat Advisory,Moderate,Likely,Expected,Heat Advisory issued August 14 at 12:51PM CDT until August 14 at 9:00PM CDT by NWS Amarillo TX,"* WHAT...Temperature up to 105 degrees expected.

* WHERE...Palo Duro Canyon.

* WHEN...Until 9 PM CDT this evening.

* IMPACTS...Hot temperatures combined with humidity may cause heat
illnesses.

* ADDITIONAL DETAILS...Terrain features present in the canyon may
see temperatures exceed 105 degrees down near the canyon floor.","Drink plenty of fluids, stay in an air-conditioned room, stay out of
the sun, and check up on relatives and neighbors.

Take extra precautions when outside. Wear lightweight and loose
fitting clothing. Try to limit strenuous activities to early morning
or evening. Take action when you see symptoms of heat exhaustion and
heat stroke.",2025-08-14 17:51:00+00:00,2025-08-14 17:51:00+00:00,2025-08-15 02:00:00+00:00,Actual,Update,NWS Amarillo TX,http://www.weather.gov,
urn:oid:2.49.0.1.840.0.3cfc29f9e678e15441430f09a875afcac7856b3d.001.1,Logan; Simpson,Special Weather Statement,Moderate,Observed,Expected,Special Weather Statement issued August 14 at 12:47PM CDT by NWS Louisville KY,"At 1247 PM CDT, Doppler radar was tracking a strong thunderstorm near
Russellville, moving southeast at 15 mph.

HAZARD...Wind gusts up to 40 mph and pea size hail.

SOURCE...Radar indicated.

IMPACT...Gusty winds could knock down tree limbs and blow around
unsecured objects. Minor hail damage to vegetation is
possible.

Locations impacted include...
Auburn, Gasper, Chandlers Chapel, South Union, and Dennis.","If outdoors, consider seeking shelter inside a building.

Torrential rainfall is also occurring with this storm and may lead to
localized flooding. Do not drive your vehicle through flooded
roadways.

Frequent cloud to ground lightning is occurring with this storm.
Lightning can strike 10 miles away from a thunderstorm. Seek a safe
shelter inside a building or vehicle.",2025-08-14 17:47:00+00:00,2025-08-14 17:47:00+00:00,2025-08-14 18:15:00+00:00,Actual,Alert,NWS Louisville KY,http://www.weather.gov,Polygon
