id,area_desc,event,severity,certainty,urgency,headline,description,instruction,sent,effective,expires,status,message_type,sender_name,web,geometry_type
urn:oid:2.49.0.1.840.0.aabacb83844a5aeecfe0c2a1080443c078a31748.001.1,Ventura County Beaches; Malibu Coast; Los Angeles County Beaches,Beach Hazards Statement,Moderate,Likely,Expected,Beach Hazards Statement issued August 14 at 2:17AM PDT until August 15 at 2:00AM PDT by NWS Los Angeles/Oxnard CA,"* WHAT...Dangerous rip currents and breaking waves due to
elevated surf of 3 to 6 feet. Local sets to 7 feet possible
along the Malibu Coast through Thursday night.

* WHERE...Ventura County Beaches, Malibu Coast and Los Angeles
County Beaches.

* WHEN...Through late tonight (2 am Friday).

* IMPACTS...There is an increased risk of ocean drowning. Rip
currents can pull swimmers and surfers out to sea. Waves can
wash people off beaches and rocks, and capsize small boats
nearshore.","Remain out of the water due to hazardous swimming conditions, or
stay near occupied lifeguard towers. Rock jetties can be deadly
in such conditions, stay off the rocks.",2025-08-14 09:17:00+00:00,2025-08-14 09:17:00+00:00,2025-08-14 22:00:00+00:00,Actual,Update,NWS Los Angeles/Oxnard CA,http://www.weather.gov,
urn:oid:2.49.0.1.840.0-KEEPALIVE-28367,Montgomery,Test Message,Unknown,Unknown,Unknown,,Monitoring message only. Please disregard.,Monitoring message only. Please disregard.,2025-08-14 09:13:34+00:00,2025-08-14 09:13:34+00:00,2025-08-14 09:23:34+00:00,Test,Alert,NWS,http://www.weather.gov,
urn:oid:2.49.0.1.840.0.7b0668f52550dbaf10b536b50fa39fe691654d64.001.1,Coastal waters from Cape Shoalwater WA to Cape Falcon OR out 10 nm; Coastal waters from Cape Falcon to Cape Foulweather OR out 10 nm; Waters from Cape Shoalwater WA to Cape Falcon OR from 10 to 60 nm; Waters from Cape Falcon to Cape Foulweather OR from 10 to 60 nm,Small Craft Advisory,Minor,Likely,Expected,Small Craft Advisory issued August 14 at 2:13AM PDT until August 16 at 5:00AM PDT by NWS Portland OR,"* WHAT...Seas 4 to 7 ft at 8 seconds and south to southwest winds
10 to 20 kt with gusts up to 30 kt expected.

* WHERE...Coastal waters from Cape Shoalwater WA to Cape Falcon
OR out 10 NM, Coastal waters from Cape Falcon to Cape
Foulweather OR out 10 NM, Waters from Cape Shoalwater WA to
Cape Falcon OR from 10 to 60 NM and Waters from Cape Falcon to
Cape Foulweather OR from 10 to 60 NM.

* WHEN...From 8 AM Friday to 5 AM PDT Saturday.

* IMPACTS...Conditions will be hazardous to small craft.","Inexperienced mariners, especially those operating smaller
vessels, should avoid navigating in hazardous conditions.",2025-08-14 09:13:00+00:00,2025-08-14 09:13:00+00:00,2025-08-15 00:00:00+00:00,Actual,Alert,NWS Portland OR,http://www.weather.gov,
urn:oid:2.49.0.1.840.0.7b0668f52550dbaf10b536b50fa39fe691654d64.003.1,Columbia River Bar,Small Craft Advisory,Minor,Likely,Expected,Small Craft Advisory issued August 14 at 2:13AM PDT until August 16 at 5:00AM PDT by NWS Portland OR,"* WHAT...Rough bar conditions expected. Seas 4 to 6 ft and south
winds 15 to 25 kt with gusts up to 30 kt.

* WHERE...In the Main Channel of the Columbia River Bar.

* WHEN...From 8 AM Friday to 5 AM PDT Saturday.

* IMPACTS...Conditions will be hazardous to small craft,
especially when operating near to, or attempting to cross, the
Columbia River Bar.

* ADDITIONAL DETAILS...First ebb current of 4.22 kt at 839 AM
Thursday with seas to 4 ft. Second ebb current of 5.36 kt at 922
PM Thursday with seas 4 to 5 ft. Third ebb current of 3.38 kt at
933 AM Friday with seas 5 to 6 ft.","A Small Craft Advisory means that wave conditions are expected to
be hazardous to small craft in the vicinity of the Columbia River
Bar. Mariners are advised to obtain the latest bar conditions
from the United States Coast Guard before attempting to cross the
bar.",2025-08-14 09:13:00+00:00,2025-08-14 09:13:00+00:00,2025-08-15 00:00:00+00:00,Actual,Alert,NWS Portland OR,http://www.weather.gov,
urn:oid:2.49.0.1.840.0.7b0668f52550dbaf10b536b50fa39fe691654d64.002.1,Coastal waters from Cape Foulweather to Florence OR out 10 nm; Waters from Cape Foulweather to Florence OR from 10 to 60 nm,Small Craft Advisory,Minor,Likely,Expected,Small Craft Advisory issued August 14 at 2:13AM PDT until August 16 at 5:00AM PDT by NWS Portland OR,"* WHAT...Seas 4 to 7 ft at 6 seconds and south to southwest winds
10 to 15 kt with gusts up to 25 kt expected.

* WHERE...Coastal waters from Cape Foulweather to Florence OR
out 10 NM and Waters from Cape Foulweather to Florence OR from
10 to 60 NM.

* WHEN...From 2 PM Friday to 5 AM PDT Saturday.

* IMPACTS...Conditions will be hazardous to small craft.","Inexperienced mariners, especially those operating smaller
vessels, should avoid navigating in hazardous conditions.",2025-08-14 09:13:00+00:00,2025-08-14 09:13:00+00:00,2025-08-15 00:00:00+00:00,Actual,Alert,NWS Portland OR,http://www.weather.gov,
urn:oid:2.49.0.1.840.0.3b119467d88ba19eaac3c851dccd01062a4d92f3.002.1,Coastal Franklin,Rip Current Statement,Moderate,Likely,Expected,Rip Current Statement issued August 14 at 5:10AM EDT until August 14 at 5:00AM EDT by NWS Tallahassee FL,,,2025-08-14 09:10:00+00:00,2025-08-14 09:10:00+00:00,2025-08-14 10:15:00+00:00,Actual,Alert,NWS Tallahassee FL,http://www.weather.gov,
urn:oid:2.49.0.1.840.0.3b119467d88ba19eaac3c851dccd01062a4d92f3.001.1,South Walton; Coastal Bay; Coastal Gulf,Rip Current Statement,Moderate,Likely,Expected,Rip Current Statement issued August 14 at 5:10AM EDT until August 14 at 5:00AM EDT by NWS Tallahassee FL,"* WHAT...Dangerous rip currents.

* WHERE...Walton, Bay, and Gulf County Beaches.

* WHEN...Through late tonight.

* IMPACTS...Rip currents can sweep even the best swimmers away
from shore into deeper water.","Swim near a lifeguard. If caught in a rip current, relax and
float. Don't swim against the current. If able, swim in a
direction following the shoreline. If unable to escape, face the
shore and call or wave for help.",2025-08-14 09:10:00+00:00,2025-08-14 09:10:00+00:00,2025-08-15 06:00:00+00:00,Actual,Alert,NWS Tallahassee FL,http://www.weather.gov,
urn:oid:2.49.0.1.840.0.3b119467d88ba19eaac3c851dccd01062a4d92f3.001.2,South Walton; Coastal Bay; Coastal Gulf,Rip Current Statement,Moderate,Likely,Expected,Rip Current Statement issued August 14 at 5:10AM EDT until August 15 at 2:00AM EDT by NWS Tallahassee FL,"* WHAT...Dangerous rip currents.

* WHERE...Walton, Bay, and Gulf County Beaches.

* WHEN...Through late tonight.

* IMPACTS...Rip currents can sweep even the best swimmers away
from shore into deeper water.","Swim near a lifeguard. If caught in a rip current, relax and
float. Don't swim against the current. If able, swim in a
direction following the shoreline. If unable to escape, face the
shore and call or wave for help.",2025-08-14 09:10:00+00:00,2025-08-14 09:10:00+00:00,2025-08-15 06:00:00+00:00,Actual,Alert,NWS Tallahassee FL,http://www.weather.gov,
urn:oid:2.49.0.1.840.0.7993f173db305cbdf83fb92a72ab4230878594f6.001.1,Greeley; Nance; Howard; Merrick; Polk; Hall; Hamilton; York; Adams; Clay; Fillmore; Nuckolls; Thayer,Heat Advisory,Moderate,Likely,Expected,Heat Advisory issued August 14 at 4:08AM CDT until August 15 at 8:00PM CDT by NWS Hastings NE,"* WHAT...Heat index values of 100 to 110 on Friday and Heat index
values as high as 107 on Saturday.

* WHERE...Portions of central, east central, and south central
Nebraska.

* WHEN...Noon to 8 PM CDT Friday and noon to 8 PM CDT Saturday.

* IMPACTS...Hot temperatures and high humidity may cause heat
illnesses.","Drink plenty of fluids, stay in an air-conditioned room, stay out of
the sun, and check up on relatives and neighbors.",2025-08-14 09:08:00+00:00,2025-08-14 09:08:00+00:00,2025-08-14 21:00:00+00:00,Actual,Alert,NWS Hastings NE,http://www.weather.gov,
urn:oid:2.49.0.1.840.0.7993f173db305cbdf83fb92a72ab4230878594f6.002.1,Valley; Sherman; Dawson; Buffalo; Gosper; Phelps; Kearney; Furnas; Harlan; Franklin; Webster,Heat Advisory,Moderate,Likely,Expected,Heat Advisory issued August 14 at 4:08AM CDT until August 15 at 8:00PM CDT by NWS Hastings NE,"* WHAT...Heat index values up to 105 expected.

* WHERE...Portions of central and south central Nebraska.

* WHEN...From noon to 8 PM CDT Friday.

* IMPACTS...Hot temperatures and high humidity may cause heat
illnesses.","Drink plenty of fluids, stay in an air-conditioned room, stay out of
the sun, and check up on relatives and neighbors.",2025-08-14 09:08:00+00:00,2025-08-14 09:08:00+00:00,2025-08-14 21:00:00+00:00,Actual,Alert,NWS Hastings NE,http://www.weather.gov,
urn:oid:2.49.0.1.840.0.7993f173db305cbdf83fb92a72ab4230878594f6.001.2,Greeley; Nance; Howard; Merrick; Polk; Hall; Hamilton; York; Adams; Clay; Fillmore; Nuckolls; Thayer,Heat Advisory,Moderate,Likely,Expected,Heat Advisory issued August 14 at 4:08AM CDT until August 16 at 8:00PM CDT by NWS Hastings NE,"* WHAT...Heat index values of 100 to 110 on Friday and Heat index
values as high as 107 on Saturday.

* WHERE...Portions of central, east central, and south central
Nebraska.

* WHEN...Noon to 8 PM CDT Friday and noon to 8 PM CDT Saturday.

* IMPACTS...Hot temperatures and high humidity may cause heat
illnesses.","Drink plenty of fluids, stay in an air-conditioned room, stay out of
the sun, and check up on relatives and neighbors.",2025-08-14 09:08:00+00:00,2025-08-14 09:08:00+00:00,2025-08-14 21:00:00+00:00,Actual,Alert,NWS Hastings NE,http://www.weather.gov,
urn:oid:2.49.0.1.840.0.0d0e25d11875e3d7ecf5556a9fac152fb8c48d55.001.1,"Henderson, NC; Transylvania, NC",Flood Advisory,Minor,Likely,Expected,Flood Advisory issued August 14 at 5:08AM EDT until August 14 at 11:15AM EDT by NWS Greenville-Spartanburg SC,"* WHAT...Flooding caused by excessive rainfall continues.

* WHERE...A portion of western North Carolina, including the
following counties, Henderson and Transylvania.

* WHEN...Until 1115 AM EDT Thursday.

* IMPACTS...Minor flooding in low-lying and poor drainage areas.

* ADDITIONAL DETAILS...
- At 506 AM EDT, At 430 AM EDT, the gauge on Mud Creek had a
stage of 12.7 feet. Common, nuisance flooding of low-lying
areas adjacent to Mud Creek is ongoing. The lowest elevations
of William H King Memorial Park are beginning to flood and
floodwaters are approaching the lowest elevations of the
Oklawaha Greenway. At this stage, more expansive lowland
flooding with nuisance impacts to adjacent farmland, golf
courses, and nurseries is ongoing or has recently occurred
upstream closer to Erkwood Drive. Although heavy rainfall has
ended, the creek level will remain nearly steady early this
morning, then slowly fall through late morning.
- http://www.weather.gov/safety/flood","Turn around, don't drown when encountering flooded roads. Most flood
deaths occur in vehicles.

Be especially cautious at night when it is harder to recognize the
dangers of flooding.",2025-08-14 09:08:00+00:00,2025-08-14 09:08:00+00:00,2025-08-14 15:15:00+00:00,Actual,Update,NWS Greenville-Spartanburg SC,http://www.weather.gov,Polygon
urn:oid:2.49.0.1.840.0-KEEPALIVE-31163,Montgomery,Test Message,Unknown,Unknown,Unknown,,Monitoring message only. Please disregard.,Monitoring message only. Please disregard.,2025-08-14 09:03:34+00:00,2025-08-14 09:03:34+00:00,2025-08-14 09:13:34+00:00,Test,Alert,NWS,http://www.weather.gov,
urn:oid:2.49.0.1.840.0.641fdfebcebce7a0793568ad5842c3dc9c208d6f.001.1,Boyd; Holt; Blaine; Loup; Garfield; Wheeler; Logan; Custer; Keith; Perkins; Lincoln; Chase; Hayes; Frontier,Heat Advisory,Moderate,Likely,Expected,Heat Advisory issued August 14 at 4:03AM CDT until August 15 at 8:00PM CDT by NWS North Platte NE,"* WHAT...Heat index values up to 102 expected.

* WHERE...Portions of central, north central, southwest, and west
central Nebraska.

* WHEN...From 1 PM CDT /noon MDT/ to 8 PM CDT /7 PM MDT/ Friday.

* IMPACTS...Hot temperatures and high humidity may cause heat
illnesses.","Drink plenty of fluids, stay in an air-conditioned room, stay out of
the sun, and check up on relatives and neighbors.

Take extra precautions when outside. Wear lightweight and loose
fitting clothing. Try to limit strenuous activities to early morning
or evening. Take action when you see symptoms of heat exhaustion and
heat stroke.",2025-08-14 09:03:00+00:00,2025-08-14 09:03:00+00:00,2025-08-14 21:15:00+00:00,Actual,Alert,NWS North Platte NE,http://www.weather.gov,
urn:oid:2.49.0.1.840.0.a260f70d0f38c541d33e928976768652b0f062cf.001.1,Extreme Western Allegany; Central and Eastern Allegany; Western Garrett; Eastern Garrett; Western Mineral; Eastern Mineral,Dense Fog Advisory,Moderate,Likely,Expected,Dense Fog Advisory issued August 14 at 5:02AM EDT until August 14 at 10:00AM EDT by NWS Baltimore MD/Washington DC,"* WHAT...Visibility one-quarter of a mile or less in dense fog.

* WHERE...In Maryland, Central and Eastern Allegany, Eastern
Garrett, Extreme Western Allegany, and Western Garrett Counties.
In West Virginia, Eastern Mineral and Western Mineral Counties.

* WHEN...Until 10 AM EDT this morning.

* IMPACTS...Low visibility could make driving conditions hazardous.","If driving, slow down, use your headlights, and leave plenty of
distance ahead of you.",2025-08-14 09:02:00+00:00,2025-08-14 09:02:00+00:00,2025-08-14 14:00:00+00:00,Actual,Alert,NWS Baltimore MD/Washington DC,http://www.weather.gov,
urn:oid:2.49.0.1.840.0.cd24feceee8cabdb603f3e8bf3b5963437e52566.001.1,Fairfield; Kershaw; Southern Lancaster,Special Weather Statement,Moderate,Observed,Expected,Special Weather Statement issued August 14 at 4:55AM EDT by NWS Columbia SC,"At 455 AM EDT, Doppler radar was tracking a strong thunderstorm over
Elgin, or 11 miles south of Lancaster, moving northeast at 15 mph.

HAZARD...Wind gusts up to 40 mph.

SOURCE...Radar indicated.

IMPACT...Gusty winds could knock down tree limbs and blow around
unsecured objects.

Locations impacted include...
Lancaster, Kershaw, Elgin, Heath Springs, Westville, USC Lancaster,
Irwin, Mt Pisgah, Fishing Creek Reservoir, Arrowood Estates, Bell
Town Fire Station, Camp Creek Fire Station, Antioch, Kirk Air Base,
Faith Christian School, Forty Acre Rock Preserve, Taxahaw, Pleasant
Hill, Kershaw Correctional Institution, and Lancaster Mill.","If outdoors, consider seeking shelter inside a building.

Torrential rainfall is also occurring with this storm and may lead to
localized flooding. Do not drive your vehicle through flooded
roadways.",2025-08-14 08:55:00+00:00,2025-08-14 08:55:00+00:00,2025-08-14 09:30:00+00:00,Actual,Alert,NWS Columbia SC,http://www.weather.gov,Polygon
urn:oid:2.49.0.1.840.0-KEEPALIVE-48743,Montgomery,Test Message,Unknown,Unknown,Unknown,,Monitoring message only. Please disregard.,Monitoring message only. Please disregard.,2025-08-14 08:53:34+00:00,2025-08-14 08:53:34+00:00,2025-08-14 09:03:34+00:00,Test,Alert,NWS,http://www.weather.gov,
urn:oid:2.49.0.1.840.0.7680ffa60b776e2a6d2bc8059b37de9135e9690d.001.1,Salt Lake Desert; Wasatch Mountains; Uinta Mountains; Western Ashley National Forest; Western Uintah Basin; Southern Ashley National Forest; Tavaputs Plateau; Manti National Forest; San Rafael Swell; Central Utah Mountains; Henry Mountains; Color Country Mountains; Grand Staircase,Red Flag Warning,Severe,Likely,Expected,Red Flag Warning issued August 14 at 2:53AM MDT until August 14 at 9:00PM MDT by NWS Salt Lake City UT,"* AFFECTED AREA...Fire Weather Zone 478 Salt Lake Desert, Fire
Weather Zone 479 Wasatch Mountains, Fire Weather Zone 480
Uinta Mountains, Fire Weather Zone 481 Western Ashley National
Forest, Fire Weather Zone 482 Western Uintah Basin, Fire
Weather Zone 483 Southern Ashley National Forest, Fire Weather
Zone 484 Tavaputs Plateau, Fire Weather Zone 488 Manti
National Forest, Fire Weather Zone 489 San Rafael Swell, Fire
Weather Zone 493 Central Utah Mountains, Fire Weather Zone 494
Henry Mountains, Fire Weather Zone 496 Color Country Mountains
and Fire Weather Zone 498 Grand Staircase.

* THUNDERSTORMS...Scattered thunderstorms will form over the
higher terrain of Utah during the afternoon and drift into the
adjacent valleys through the evening. Given the extended
period of very dry conditions with little to no rain, new
wildfire starts are likely with any lightning.

* OUTFLOW WINDS...Gusty and erratic outflow winds up to 50 mph
are possible with any thunderstorms.

* IMPACTS...Critical fire weather conditions are expected. Any
new fire starts or existing fires may spread rapidly.","A Red Flag Warning means that critical fire weather conditions
are either occurring now...or are imminent. A combination of
lightning...dry fuel conditions...and gusty microburst winds will
create favorable conditions for new fire starts and extreme fire
behavior.",2025-08-14 08:53:00+00:00,2025-08-14 08:53:00+00:00,2025-08-14 22:00:00+00:00,Actual,Update,NWS Salt Lake City UT,http://www.weather.gov,
urn:oid:2.49.0.1.840.0.74f760f9ca7f90cc9c9a622366531fc8605430c1.001.1,Tuscarawas; Carroll; Columbiana; Coshocton; Harrison; Jefferson; Muskingum; Guernsey; Belmont; Noble; Monroe; Mercer; Venango; Lawrence; Butler; Beaver; Hancock; Brooke; Ohio; Marshall; Wetzel,Special Weather Statement,Moderate,Observed,Expected,Special Weather Statement issued August 14 at 4:51AM EDT by NWS Pittsburgh PA,"Areas of fog, some locally dense, will continue across the area
early this morning. Visibility will be reduced to a quarter of a
mile or less at times. Use caution if traveling, and be prepared
for rapid changes in visibility over a short distance.

The fog is expected to gradually dissipate between sunrise and 9
AM.",,2025-08-14 08:51:00+00:00,2025-08-14 08:51:00+00:00,2025-08-14 13:00:00+00:00,Actual,Alert,NWS Pittsburgh PA,http://www.weather.gov,
urn:oid:2.49.0.1.840.0.4f52bbebd3211d643d857fb50b78577c68555638.001.1,Little Snake; Routt; White River; Lower Colorado River; Colorado River Headwaters; Southwest Colorado Lower Forecast Area; Paradox Valley; Northern San Juan; North Fork; Gunnison Basin; Southwest Colorado Upper West Forecast Area; Southwest Colorado Upper East Forecast Area; Eastern Ashley National Forest; Eastern Uintah Basin; Book Cliffs; Colorado River Basin; Southeast Utah,Red Flag Warning,Severe,Likely,Expected,Red Flag Warning issued August 14 at 2:50AM MDT until August 14 at 10:00PM MDT by NWS Grand Junction CO,"* AFFECTED AREA...In Colorado, Fire Weather Zone 200 Little
Snake Forecast Area, Fire Weather Zone 201 Routt Forecast
Area, Fire Weather Zone 202 White River Forecast Area, Fire
Weather Zone 203 Lower Colorado River, Fire Weather Zone 205
Colorado River Headwaters, Fire Weather Zone 207 Southwest
Colorado Lower Forecast Area, Fire Weather Zone 290 Paradox
Valley Forecast Area, Fire Weather Zone 291 Northern San Juan
Forecast Area, Fire Weather Zone 292 North Fork Forecast Area,
Fire Weather Zone 293 Gunnison Basin Forecast Area, Fire
Weather Zone 294 Southwest Colorado Upper West Forecast Area
and Fire Weather Zone 295 Southwest Colorado Upper East
Forecast Area. In Utah, Fire Weather Zone 485 Eastern Ashley
National Forest, Fire Weather Zone 486 Eastern Uinta Basin,
Fire Weather Zone 487 Book Cliffs, Fire Weather Zone 490
Colorado River Basin and Fire Weather Zone 491 Southeast Utah.

* TIMING...For the Red Flag Warning, from noon today to 10 PM
MDT this evening. For the Fire Weather Watch, from Friday
afternoon through Friday evening.

* WINDS...Southwest 10 to 15 mph with gusts up to 25 mph.

* RELATIVE HUMIDITY...9 to 14 percent.

* IMPACTS...Any fire that develops will catch and spread
quickly. Outdoor burning is not recommended.

* THUNDERSTORMS...Scattered dry thunderstorms on Thursday and
Friday will be capable of producing frequent lightning and
gusty outflow winds which, when combined with extremely dry
conditions, will be capable of producing fire starts.","A Red Flag Warning means that critical fire weather conditions
are either occurring now, or will shortly. A combination of
strong winds, low relative humidity, and warm temperatures can
contribute to extreme fire behavior.

A Fire Weather Watch means that critical fire weather conditions
are forecast to occur. Listen for later forecasts and possible
Red Flag Warnings.",2025-08-14 08:50:00+00:00,2025-08-14 08:50:00+00:00,2025-08-15 00:00:00+00:00,Actual,Update,NWS Grand Junction CO,http://www.weather.gov,
urn:oid:2.49.0.1.840.0.4f52bbebd3211d643d857fb50b78577c68555638.001.2,Little Snake; Routt; White River; Lower Colorado River; Colorado River Headwaters; Southwest Colorado Lower Forecast Area; Paradox Valley; Northern San Juan; North Fork; Gunnison Basin; Southwest Colorado Upper West Forecast Area; Southwest Colorado Upper East Forecast Area; Eastern Ashley National Forest; Eastern Uintah Basin; Book Cliffs; Colorado River Basin; Southeast Utah,Fire Weather Watch,Severe,Possible,Future,Fire Weather Watch issued August 14 at 2:50AM MDT until August 15 at 10:00PM MDT by NWS Grand Junction CO,"* AFFECTED AREA...In Colorado, Fire Weather Zone 200 Little
Snake Forecast Area, Fire Weather Zone 201 Routt Forecast
Area, Fire Weather Zone 202 White River Forecast Area, Fire
Weather Zone 203 Lower Colorado River, Fire Weather Zone 205
Colorado River Headwaters, Fire Weather Zone 207 Southwest
Colorado Lower Forecast Area, Fire Weather Zone 290 Paradox
Valley Forecast Area, Fire Weather Zone 291 Northern San Juan
Forecast Area, Fire Weather Zone 292 North Fork Forecast Area,
Fire Weather Zone 293 Gunnison Basin Forecast Area, Fire
Weather Zone 294 Southwest Colorado Upper West Forecast Area
and Fire Weather Zone 295 Southwest Colorado Upper East
Forecast Area. In Utah, Fire Weather Zone 485 Eastern Ashley
National Forest, Fire Weather Zone 486 Eastern Uinta Basin,
Fire Weather Zone 487 Book Cliffs, Fire Weather Zone 490
Colorado River Basin and Fire Weather Zone 491 Southeast Utah.

* TIMING...For the Red Flag Warning, from noon today to 10 PM
MDT this evening. For the Fire Weather Watch, from Friday
afternoon through Friday evening.

* WINDS...Southwest 10 to 15 mph with gusts up to 25 mph.

* RELATIVE HUMIDITY...9 to 14 percent.

* IMPACTS...Any fire that develops will catch and spread
quickly. Outdoor burning is not recommended.

* THUNDERSTORMS...Scattered dry thunderstorms on Thursday and
Friday will be capable of producing frequent lightning and
gusty outflow winds which, when combined with extremely dry
conditions, will be capable of producing fire starts.","A Red Flag Warning means that critical fire weather conditions
are either occurring now, or will shortly. A combination of
strong winds, low relative humidity, and warm temperatures can
contribute to extreme fire behavior.

A Fire Weather Watch means that critical fire weather conditions
are forecast to occur. Listen for later forecasts and possible
Red Flag Warnings.",2025-08-14 08:50:00+00:00,2025-08-14 08:50:00+00:00,2025-08-15 00:00:00+00:00,Actual,Update,NWS Grand Junction CO,http://www.weather.gov,
urn:oid:2.49.0.1.840.0.20aa006f3fa7728e6ac86bb90f433bdd58bc44ec.001.1,Jackson County Below 9000 Feet; South and Southeast Grand/West Central and Southwest Boulder/Gilpin/Clear Creek/Summit/North and West Park Counties Above 9000 Feet; Grand and Summit Counties Below 9000 Feet; Central and Southeast Park County; Larimer and Boulder Counties Between 6000 and 9000 Feet; Jefferson and West Douglas Counties Above  6000 Feet/Gilpin/Clear Creek/Northeast Park Counties Below 9000 Feet; West Jackson and West Grand Counties Above 9000 Feet; South and East Jackson/Larimer/North and Northeast Grand/Northwest Boulder Counties Above 9000 Feet,Red Flag Warning,Severe,Likely,Expected,Red Flag Warning issued August 14 at 2:50AM MDT until August 14 at 10:00PM MDT by NWS Denver CO,"* AFFECTED AREA...Fire Weather Zones 211, 212, 213, 214, 215,
216, 217 and 218.

* TIMING...From noon today to 10 PM MDT this evening.

* WINDS...Southwest 5 to 15 mph, but gusts to 40 mph in/near any
showers and thunderstorms.

* IMPACTS...Conditions will be favorable for rapid fire spread.
Avoid outdoor burning and any activity that may produce a
spark and start a wildfire.

* Thunderstorms...Dry thunderstorms (storms with lightning but
little rainfall) will be possible Thursday afternoon and
evening.","A Red Flag Warning means that critical fire weather conditions
are either occurring now....or will shortly. A combination of dry
thunderstorms, strong winds, low relative humidity, and warm
temperatures can contribute to extreme fire behavior.",2025-08-14 08:50:00+00:00,2025-08-14 08:50:00+00:00,2025-08-15 04:00:00+00:00,Actual,Update,NWS Denver CO,http://www.weather.gov,
urn:oid:2.49.0.1.840.0.26b7bbfc0ee5d642f3957dee3d61d77109c97d4d.001.1,Eastern Elko County,Red Flag Warning,Severe,Likely,Expected,Red Flag Warning issued August 14 at 1:46AM PDT until August 14 at 8:00PM PDT by NWS Elko NV,"* AFFECTED AREA...Fire weather zone 470.

* THUNDERSTORMS...Scattered dry thunderstorms are expected in
Eastern Elko County Thursday afternoon into Thursday evening.
Enter bullet text

* IMPACTS...Any fires that develop from dry lightning will
likely spread rapidly. Outdoor burning is not recommended.","A Red Flag Warning means that critical fire weather conditions
are either occurring now, or will shortly. A combination of dry
fuels and strong, gusty outflow wind gusts can contribute to
extreme fire behavior.",2025-08-14 08:46:00+00:00,2025-08-14 08:46:00+00:00,2025-08-14 17:00:00+00:00,Actual,Update,NWS Elko NV,http://www.weather.gov,
urn:oid:2.49.0.1.840.0-KEEPALIVE-23803,Montgomery,Test Message,Unknown,Unknown,Unknown,,Monitoring message only. Please disregard.,Monitoring message only. Please disregard.,2025-08-14 08:43:34+00:00,2025-08-14 08:43:34+00:00,2025-08-14 08:53:34+00:00,Test,Alert,NWS,http://www.weather.gov,
