id,area_desc,event,severity,certainty,urgency,headline,description,instruction,sent,effective,expires,status,message_type,sender_name,web,geometry_type
urn:oid:2.49.0.1.840.0.d2b9fc47f0ccf5f0b68ef134fb702cd35e4974dd.001.1,"Maricopa, AZ",Severe Thunderstorm Warning,Severe,Observed,Immediate,Severe Thunderstorm Warning issued August 13 at 9:40PM MST until August 13 at 10:00PM MST by NWS Phoenix AZ,"At 940 PM MST, a severe thunderstorm was located near Phoenix
International Raceway, or near Tolleson, and is nearly stationary.

HAZARD...60 mph wind gusts.

SOURCE...Radar indicated.

IMPACT...Expect damage to roofs, siding, and trees.

Locations impacted include...
Phoenix, Avondale, Tolleson, Cashion, Laveen, and Phoenix
International Raceway.

This includes the following highways...
AZ Interstate 10 between mile markers 130 and 139.
AZ Route 101 between mile markers 2 and 5.","For your protection move to an interior room on the lowest floor of a
building.

Continuous cloud to ground lightning is occurring with this storm.
Move indoors immediately. Lightning is one of nature's leading
killers. Remember, if you can hear thunder, you are close enough to
be struck by lightning.",2025-08-14 04:40:00+00:00,2025-08-14 04:40:00+00:00,2025-08-14 05:00:00+00:00,Actual,Update,NWS Phoenix AZ,http://www.weather.gov,Polygon
urn:oid:2.49.0.1.840.0.e8dbb969b1026d332bbc5692c5bd2e1c3b89417a.001.1,"Maricopa, AZ",Flood Advisory,Minor,Likely,Expected,Flood Advisory issued August 13 at 9:39PM MST until August 14 at 12:45AM MST by NWS Phoenix AZ,"* WHAT...Flooding caused by excessive rainfall is expected.

* WHERE...A portion of south central Arizona, including the
following county, Maricopa.

* WHEN...Until 1245 AM MST.

* IMPACTS...Minor flooding in low-lying and poor drainage areas.
Ponding of water in urban or other areas is occurring or is
imminent.

* ADDITIONAL DETAILS...
- At 939 PM MST, Doppler radar and automated rain gauges
indicated heavy rain due to thunderstorms. Minor flooding is
ongoing or expected to begin shortly in the advisory area.
Between 0.25 and 0.75 inches of rain have fallen.
- This includes the following streams and drainages...
Gila River, Cave Creek and Salt River.
Additional rainfall amounts up to 0.5 inches are expected
over the area. This additional rain will result in minor
flooding.
- Some locations that will experience flooding include...
Phoenix, Avondale, Tolleson, Laveen and Phoenix International
Raceway.
- http://www.weather.gov/safety/flood","Turn around, don't drown when encountering flooded roads. Most flood
deaths occur in vehicles.

Please report observed flooding to local emergency services or law
enforcement and request they pass this information to the National
Weather Service when you can do so safely.",2025-08-14 04:39:00+00:00,2025-08-14 04:39:00+00:00,2025-08-14 07:45:00+00:00,Actual,Alert,NWS Phoenix AZ,http://www.weather.gov,Polygon
urn:oid:2.49.0.1.840.0.84130337c6997547d4a67c49e561768fd1811295.001.1,"Charles Mix, SD; Douglas, SD; Gregory, SD",Severe Thunderstorm Warning,Severe,Observed,Immediate,Severe Thunderstorm Warning issued August 13 at 11:35PM CDT until August 14 at 12:00AM CDT by NWS Sioux Falls SD,"At 1131 PM CDT, severe thunderstorms were located along a line
extending from near Armour to near Delmont to near Dante to 11 miles
north of Page to near Amelia, moving east at 50 mph.

HAZARD...60 mph wind gusts and penny size hail.

SOURCE...Mesonet. At 1124 PM CDT, a 57 mph wind gust was reported at
the Fort Randall Dam SD RWIS.

IMPACT...Expect damage to roofs, siding, and trees.

Locations impacted include...
Delmont and Dante.","For your protection move to an interior room on the lowest floor of a
building.",2025-08-14 04:35:00+00:00,2025-08-14 04:35:00+00:00,2025-08-14 05:00:00+00:00,Actual,Update,NWS Sioux Falls SD,http://www.weather.gov,Polygon
urn:oid:2.49.0.1.840.0-KEEPALIVE-27474,Montgomery,Test Message,Unknown,Unknown,Unknown,,Monitoring message only. Please disregard.,Monitoring message only. Please disregard.,2025-08-14 04:33:34+00:00,2025-08-14 04:33:34+00:00,2025-08-14 04:43:34+00:00,Test,Alert,NWS,http://www.weather.gov,
urn:oid:2.49.0.1.840.0.5764d7592134a08596a50a12e5532084e8245262.001.1,"Sargent, ND",Severe Thunderstorm Warning,Severe,Observed,Immediate,Severe Thunderstorm Warning issued August 13 at 11:33PM CDT until August 13 at 11:45PM CDT by NWS Grand Forks ND,"At 1133 PM CDT, a severe thunderstorm was located near Straubville,
or 17 miles northwest of Britton, moving north at 20 mph.

HAZARD...Golf ball size hail and 60 mph wind gusts.

SOURCE...Radar indicated.

IMPACT...People and animals outdoors will be injured. Expect hail
damage to roofs, siding, windows, and vehicles. Expect wind
damage to roofs, siding, and trees.

Locations impacted include...
Straubville.","This is a dangerous storm. Prepare immediately for large destructive
hail capable of producing significant damage. People outside should
move to a shelter, inside a strong building and away from windows.",2025-08-14 04:33:00+00:00,2025-08-14 04:33:00+00:00,2025-08-14 04:45:00+00:00,Actual,Update,NWS Grand Forks ND,http://www.weather.gov,Polygon
urn:oid:2.49.0.1.840.0.6824e2b4b2ec9c39f308ba1daf81881b9cd9e7a1.001.1,Forsyth; Guilford; Davidson,Special Weather Statement,Moderate,Observed,Expected,Special Weather Statement issued August 14 at 12:31AM EDT by NWS Raleigh NC,"At 1230 AM EDT, Doppler radar was tracking a strong thunderstorm near
Mocksville, moving east at 30 mph.

HAZARD...Wind gusts up to 40 mph and pea size hail.

SOURCE...Radar indicated.

IMPACT...Gusty winds could knock down tree limbs and blow around
unsecured objects. Minor hail damage to vegetation is
possible.

Locations impacted include...
Winston-Salem, High Point, Thomasville, Kernersville, Clemmons,
Bermuda Run, Lewisville, Jamestown, Oak Hollow Marina, and Arcadia.","If outdoors, consider seeking shelter inside a building.

Torrential rainfall is also occurring with this storm and may lead to
localized flooding. Do not drive your vehicle through flooded
roadways.",2025-08-14 04:31:00+00:00,2025-08-14 04:31:00+00:00,2025-08-14 05:30:00+00:00,Actual,Alert,NWS Raleigh NC,http://www.weather.gov,Polygon
urn:oid:2.49.0.1.840.0.a6c599dce631e41de76063d2b95f5bd2149a8f15.001.1,"Antelope, NE; Knox, NE",Severe Thunderstorm Warning,Severe,Observed,Immediate,Severe Thunderstorm Warning issued August 13 at 11:26PM CDT until August 14 at 12:15AM CDT by NWS Omaha/Valley NE,"SVROAX

The National Weather Service in Omaha has issued a

* Severe Thunderstorm Warning for...
Northern Antelope County in northeastern Nebraska...
Knox County in northeastern Nebraska...

* Until 1215 AM CDT.

* At 1125 PM CDT, severe thunderstorms were located along a line
extending from 6 miles southwest of Delmont to 7 miles southeast of
Marty to 5 miles northeast of O'Neill, moving southeast at 40 mph.

HAZARD...60 mph wind gusts and penny size hail.

SOURCE...Radar indicated.

IMPACT...Expect damage to roofs, siding, and trees.

* Severe thunderstorms will be near...
Verdel around 1130 PM CDT.
Niobrara around 1140 PM CDT.
Verdigre and Santee around 1145 PM CDT.

Other locations in the path of these severe thunderstorms include
Center, Winnetoon and Creighton.","For your protection move to an interior room on the lowest floor of a
building.",2025-08-14 04:26:00+00:00,2025-08-14 04:26:00+00:00,2025-08-14 05:15:00+00:00,Actual,Alert,NWS Omaha/Valley NE,http://www.weather.gov,Polygon
urn:oid:2.49.0.1.840.0.049e393c98cc89f7e2ad32ba538642670b09d3e6.001.1,"Jackson, NC; Macon, NC; Transylvania, NC",Flood Advisory,Minor,Likely,Expected,Flood Advisory issued August 14 at 12:24AM EDT until August 14 at 12:30AM EDT by NWS Greenville-Spartanburg SC,"The Flood Advisory will expire at 1230 AM EDT early this morning for
a portion of western North Carolina, including the following areas,
Jackson, Macon and Transylvania.

The heavy rain has ended. Flooding is no longer expected to pose a
threat. Please continue to heed any remaining road closures.",,2025-08-14 04:24:00+00:00,2025-08-14 04:24:00+00:00,2025-08-14 04:34:00+00:00,Actual,Update,NWS Greenville-Spartanburg SC,http://www.weather.gov,Polygon
urn:oid:2.49.0.1.840.0-KEEPALIVE-50922,Montgomery,Test Message,Unknown,Unknown,Unknown,,Monitoring message only. Please disregard.,Monitoring message only. Please disregard.,2025-08-14 04:23:34+00:00,2025-08-14 04:23:34+00:00,2025-08-14 04:33:34+00:00,Test,Alert,NWS,http://www.weather.gov,
urn:oid:2.49.0.1.840.0.097ce2a527558ccc4968fa2bfc97246b3cade2be.001.1,"Marshall, SD",Flood Warning,Severe,Likely,Expected,Flood Warning issued August 13 at 11:23PM CDT until August 14 at 11:30AM CDT by NWS Aberdeen SD,"* WHAT...Flooding caused by excessive rainfall is expected.

* WHERE...A portion of northeast South Dakota, including the
following county, Marshall.

* WHEN...Until 1130 AM CDT Thursday.

* IMPACTS...Flooding of rivers, creeks, streams, and other low-lying
and flood-prone locations is imminent or occurring.

* ADDITIONAL DETAILS...
- At 1122 PM CDT, Doppler radar indicated heavy rain due to
thunderstorms. Flooding is ongoing or expected to begin
shortly in the warned area.
- Some locations that will experience flooding include...
Veblen, Hillhead, Veblen Flats Housing and northwestern Lake
Traverse Reservation.
- http://www.weather.gov/safety/flood","Turn around, don't drown when encountering flooded roads. Most flood
deaths occur in vehicles.

Be especially cautious at night when it is harder to recognize the
dangers of flooding.",2025-08-14 04:23:00+00:00,2025-08-14 04:23:00+00:00,2025-08-14 16:30:00+00:00,Actual,Alert,NWS Aberdeen SD,http://www.weather.gov,Polygon
urn:oid:2.49.0.1.840.0.19b561aadc5bc8c526d36b888d6241f1128a80fd.001.1,Iredell; Davie,Special Weather Statement,Moderate,Observed,Expected,Special Weather Statement issued August 14 at 12:22AM EDT by NWS Greenville-Spartanburg SC,"At 1222 AM EDT, Doppler radar was tracking a strong thunderstorm 4
miles northwest of Mocksville, moving east at 25 mph.

HAZARD...Wind gusts up to 40 mph.

SOURCE...Radar indicated.

IMPACT...Gusty winds could knock down tree limbs and blow around
unsecured objects.

Locations impacted include...
Mocksville, Bermuda Run, Sheffield, Fork Church, Farmington, and
Advance.","If outdoors, consider seeking shelter inside a building.

Torrential rainfall is also occurring with this storm and may lead to
localized flooding. Do not drive your vehicle through flooded
roadways.",2025-08-14 04:22:00+00:00,2025-08-14 04:22:00+00:00,2025-08-14 05:00:00+00:00,Actual,Alert,NWS Greenville-Spartanburg SC,http://www.weather.gov,Polygon
urn:oid:2.49.0.1.840.0.3f6102c06ceb5348ce3a5ba40f280c1754e70303.001.1,"Sargent, ND",Severe Thunderstorm Warning,Severe,Observed,Immediate,Severe Thunderstorm Warning issued August 13 at 11:15PM CDT until August 13 at 11:45PM CDT by NWS Grand Forks ND,"SVRFGF

The National Weather Service in Grand Forks has issued a

* Severe Thunderstorm Warning for...
Southwestern Sargent County in southeastern North Dakota...

* Until 1145 PM CDT.

* At 1115 PM CDT, a severe thunderstorm was located 7 miles west of
Westwood Colony, or 12 miles northwest of Britton, moving north at
30 mph.

HAZARD...Ping pong ball size hail and 60 mph wind gusts.

SOURCE...Radar indicated.

IMPACT...People and animals outdoors will be injured. Expect hail
damage to roofs, siding, windows, and vehicles. Expect
wind damage to roofs, siding, and trees.

* Locations impacted include...
Cogswell and Straubville.","For your protection move to an interior room on the lowest floor of a
building.",2025-08-14 04:15:00+00:00,2025-08-14 04:15:00+00:00,2025-08-14 04:45:00+00:00,Actual,Alert,NWS Grand Forks ND,http://www.weather.gov,Polygon
urn:oid:2.49.0.1.840.0.e9df65760bd5e25432dc014dc00e25560523232d.001.1,"Maricopa, AZ",Severe Thunderstorm Warning,Severe,Observed,Immediate,Severe Thunderstorm Warning issued August 13 at 9:14PM MST until August 13 at 10:00PM MST by NWS Phoenix AZ,"SVRPSR

The National Weather Service in Phoenix has issued a

* Severe Thunderstorm Warning for...
Maricopa County in south central Arizona...

* Until 1000 PM MST.

* At 914 PM MST, a severe thunderstorm was located over Tolleson, and
is nearly stationary.

HAZARD...60 mph wind gusts.

SOURCE...Radar indicated.

IMPACT...Expect damage to roofs, siding, and trees.

* Locations impacted include...
Phoenix, Glendale, Avondale, Goodyear, Tolleson, Laveen, Cashion,
Glendale Sports Complex, Arizona State Fairgrounds, Phoenix
International Raceway, Downtown Peoria, Downtown Glendale, and
Camelback Ranch.

This includes the following highways...
AZ Interstate 10 between mile markers 128 and 144.
AZ Interstate 17 between mile markers 199 and 202.
US Highway 60 between mile markers 150 and 160.","For your protection move to an interior room on the lowest floor of a
building.

Large hail, damaging wind, and continuous cloud to ground lightning
are occurring with this storm. Move indoors immediately. Lightning is
one of nature's leading killers. Remember, if you can hear thunder,
you are close enough to be struck by lightning.",2025-08-14 04:14:00+00:00,2025-08-14 04:14:00+00:00,2025-08-14 05:00:00+00:00,Actual,Alert,NWS Phoenix AZ,http://www.weather.gov,Polygon
urn:oid:2.49.0.1.840.0-KEEPALIVE-40831,Montgomery,Test Message,Unknown,Unknown,Unknown,,Monitoring message only. Please disregard.,Monitoring message only. Please disregard.,2025-08-14 04:13:34+00:00,2025-08-14 04:13:34+00:00,2025-08-14 04:23:34+00:00,Test,Alert,NWS,http://www.weather.gov,
urn:oid:2.49.0.1.840.0.3e1c2025305243f375c85644de5b8111d9163e36.001.1,East Baton Rouge; St. James; St. John The Baptist; St. Charles; Upper St. Bernard; Southeast St. Tammany; Western Orleans; Eastern Orleans; Northern St. Tammany; Southwestern St. Tammany; Central Tangipahoa; Lower Tangipahoa; Northern Livingston; Southern Livingston; Western Ascension; Eastern Ascension; Upper Jefferson; Lower Jefferson; Upper Plaquemines; Southern Hancock,Heat Advisory,Moderate,Likely,Expected,Heat Advisory issued August 13 at 11:13PM CDT until August 14 at 6:00PM CDT by NWS New Orleans LA,"* WHAT...Heat index values up to 111 expected.

* WHERE...Portions of southeast Louisiana and southern Mississippi
along the I-10 and I-12 corridor.

* WHEN...From 10 AM to 6 PM CDT Thursday.

* IMPACTS...Hot temperatures and high humidity may cause heat
illnesses.","Drink plenty of fluids, stay in an air-conditioned room, stay out of
the sun, and check up on relatives and neighbors.",2025-08-14 04:13:00+00:00,2025-08-14 04:13:00+00:00,2025-08-14 18:15:00+00:00,Actual,Update,NWS New Orleans LA,http://www.weather.gov,
urn:oid:2.49.0.1.840.0.a3e995d2e804216195642f399aae89805854173f.001.1,"Marshall, SD",Severe Thunderstorm Warning,Severe,Observed,Immediate,Severe Thunderstorm Warning issued August 13 at 11:13PM CDT until August 13 at 11:45PM CDT by NWS Aberdeen SD,"At 1113 PM CDT, a severe thunderstorm was located near Sunset Colony,
or near Britton, moving northeast at 15 mph.

HAZARD...Ping pong ball size hail and 60 mph wind gusts.

SOURCE...Radar indicated.

IMPACT...People and animals outdoors will be injured. Expect hail
damage to roofs, siding, windows, and vehicles. Expect wind
damage to roofs, siding, and trees.

This severe storm will be near...
Westwood Colony around 1120 PM CDT.","This storm is producing large hail. SEEK SHELTER NOW inside a sturdy
structure and stay away from windows.

To report severe weather contact your nearest law enforcement agency.
They will send your report to the National Weather Service office in
Aberdeen.",2025-08-14 04:13:00+00:00,2025-08-14 04:13:00+00:00,2025-08-14 04:45:00+00:00,Actual,Update,NWS Aberdeen SD,http://www.weather.gov,Polygon
urn:oid:2.49.0.1.840.0.1da1b841459093cb8af4e5cbbf1897fc8f55866f.001.1,Alexander; Iredell; Catawba; Greater Caldwell,Special Weather Statement,Moderate,Observed,Expected,Special Weather Statement issued August 14 at 12:11AM EDT by NWS Greenville-Spartanburg SC,"At 1211 AM EDT, Doppler radar was tracking a strong thunderstorm 4
miles southwest of Taylorsville, moving northeast at 45 mph.

HAZARD...Wind gusts up to 40 mph.

SOURCE...Radar indicated.

IMPACT...Gusty winds could knock down tree limbs and blow around
unsecured objects.

Locations impacted include...
Taylorsville, Hickory, St. Stephens, Bethlehem, Stony Point, Love
Valley, Lake Hickory, Hudson, Granite Falls, and Conover.","If outdoors, consider seeking shelter inside a building.

Torrential rainfall is also occurring with this storm and may lead to
localized flooding. Do not drive your vehicle through flooded
roadways.",2025-08-14 04:11:00+00:00,2025-08-14 04:11:00+00:00,2025-08-14 04:45:00+00:00,Actual,Alert,NWS Greenville-Spartanburg SC,http://www.weather.gov,Polygon
urn:oid:2.49.0.1.840.0.e991587f96cb14f3e5013d1bb0d10a6681998079.001.1,"Charles Mix, SD; Gregory, SD",Severe Thunderstorm Warning,Severe,Observed,Immediate,Severe Thunderstorm Warning issued August 13 at 11:10PM CDT until August 13 at 11:15PM CDT by NWS Sioux Falls SD,"The storms which prompted the warning have moved out of the area.
Therefore, the warning will be allowed to expire.

A Severe Thunderstorm Watch remains in effect until 100 AM CDT for
south central South Dakota.

To report severe weather, contact your nearest law enforcement
agency. They will relay your report to the National Weather Service
Sioux Falls.",,2025-08-14 04:10:00+00:00,2025-08-14 04:10:00+00:00,2025-08-14 04:20:00+00:00,Actual,Update,NWS Sioux Falls SD,http://www.weather.gov,Polygon
urn:oid:2.49.0.1.840.0.602ca71aebd31730a0122e5d5f9436bd9176256b.001.1,"Boyd, NE; Holt, NE; Rock, NE",Severe Thunderstorm Warning,Severe,Observed,Immediate,Severe Thunderstorm Warning issued August 13 at 11:09PM CDT until August 14 at 12:00AM CDT by NWS North Platte NE,"SVRLBF

The National Weather Service in North Platte has issued a

* Severe Thunderstorm Warning for...
Central Rock County in north central Nebraska...
Holt County in north central Nebraska...
Eastern Boyd County in north central Nebraska...

* Until midnight CDT.

* At 1108 PM CDT, severe thunderstorms were located along a line
extending from near Gross to near Atkinson to 13 miles north of
Rose, moving east at 35 mph.

HAZARD...70 mph wind gusts.

SOURCE...Public. At 1054 PM 65 mph winds were reported 7 miles
west southwest of Butte.

IMPACT...Expect considerable tree damage. Damage is likely to
mobile homes, roofs, and outbuildings.

* Locations impacted include...
O'Neill, Spencer, Atkinson, Ewing, Chambers, Lynch, Page, Gross,
Amelia, Inman, Bristow, Emmet, Monowi, Knievels Corner, Sybrant,
Scottville, Redbird State Wildlife Management Area, Pony Lake,
Opportunity, and Spencer Dam.

This includes the following highways...
Highway 183 between mile markers 166 and 171.
Highway 20 between mile markers 282 and 328.
Highway 281 between mile markers 163 and 223.
Highway 12 between mile markers 117 and 144.","For your protection move to an interior room on the lowest floor of a
building.",2025-08-14 04:09:00+00:00,2025-08-14 04:09:00+00:00,2025-08-14 05:00:00+00:00,Actual,Alert,NWS North Platte NE,http://www.weather.gov,Polygon
urn:oid:2.49.0.1.840.0.725e671d365cae88dd3550141d4b3bde752cc116.001.1,Buckeye/Avondale; Central Phoenix; North Phoenix/Glendale; Scottsdale/Paradise Valley; South Mountain/Ahwatukee,Special Weather Statement,Moderate,Observed,Expected,Special Weather Statement issued August 13 at 9:06PM MST by NWS Phoenix AZ,"At 906 PM MST, Doppler radar was tracking a strong thunderstorm over
Arizona State Fairgrounds, or near Laveen. This thunderstorm was
nearly stationary.

HAZARD...Wind gusts up to 40 mph.

SOURCE...Radar indicated.

IMPACT...Gusty winds could knock down tree limbs and blow around
unsecured objects.

Locations impacted include...
Phoenix, Glendale, Avondale, Paradise Valley, Tolleson, Laveen,
Cashion, Glendale Sports Complex, Piestewa Peak Park, North Mountain
Park, South Phoenix, Arizona State Fairgrounds, South Mountain Park,
Phoenix International Raceway, Downtown Peoria, Downtown Phoenix,
Arrowhead Mall, Downtown Glendale, Metro Center, and Camelback Ranch.

This includes the following highways...
AZ Interstate 10 between mile markers 130 and 152.
AZ Interstate 17 between mile markers 195 and 213.
AZ Route 51 between mile markers 1 and 9.","If outdoors, consider seeking shelter inside a building.

Frequent cloud to ground lightning is occurring with this storm.
Lightning can strike 10 miles away from a thunderstorm. Seek a safe
shelter inside a building or vehicle.",2025-08-14 04:06:00+00:00,2025-08-14 04:06:00+00:00,2025-08-14 04:30:00+00:00,Actual,Alert,NWS Phoenix AZ,http://www.weather.gov,Polygon
urn:oid:2.49.0.1.840.0.2eff5e29db10e1a450ec479abd3f9fa33f32895d.001.1,"Lawrence, OH; Cabell, WV",Flash Flood Warning,Severe,Likely,Immediate,Flash Flood Warning issued August 14 at 12:06AM EDT until August 14 at 2:30AM EDT by NWS Charleston WV,"FFWRLX

The National Weather Service in Charleston has extended the

* Flash Flood Warning for...
Southeastern Lawrence County in southeastern Ohio...
Central Cabell County in central West Virginia...

* Until 230 AM EDT.

* At 1206 AM EDT, Doppler radar indicated thunderstorms producing
heavy rain in Rome and Proctorville. Between 2 and 5 inches of
rain have fallen. Flash flooding is already occurring.

HAZARD...Life threatening flash flooding. Thunderstorms
producing flash flooding.

SOURCE...Radar.

IMPACT...Life threatening flash flooding of creeks and streams,
urban areas, highways, streets and underpasses.

* Some locations that will experience flash flooding include...
Huntington, Chesapeake, Proctorville, Barboursville, Milton, Ona,
Culloden, Burlington, Athalia, Pea Ridge and Salt Rock.","Turn around, don't drown when encountering flooded roads. Most flood
deaths occur in vehicles.

Be especially cautious at night when it is harder to recognize the
dangers of flooding.

Be aware of your surroundings and do not drive on flooded roads.

Report flooding to the National Weather Service by calling toll
free, 800 401 9535, when you can do so safely.",2025-08-14 04:06:00+00:00,2025-08-14 04:06:00+00:00,2025-08-14 06:30:00+00:00,Actual,Update,NWS Charleston WV,http://www.weather.gov,Polygon
urn:oid:2.49.0.1.840.0.070be8d16264e208114f62571f6b8fb035fc0014.001.1,"Boyd, NE; Brown, NE; Holt, NE; Keya Paha, NE; Rock, NE",Severe Thunderstorm Warning,Severe,Observed,Immediate,Severe Thunderstorm Warning issued August 13 at 11:05PM CDT until August 13 at 11:15PM CDT by NWS North Platte NE,"At 1104 PM CDT, severe thunderstorms were located along a line
extending from Butte to 6 miles north of Atkinson to 14 miles south
of Newport, moving southeast at 35 mph.

HAZARD...70 mph wind gusts and penny size hail.

SOURCE...Public. At 1054 PM 65 mph winds were reported 7 miles west
southwest of Butte.

IMPACT...Expect considerable tree damage. Damage is likely to mobile
homes, roofs, and outbuildings.

Locations impacted include...
Ainsworth, Bassett, Spencer, Springview, Stuart, Butte, Long Pine,
Newport, Naper, Johnstown, Dustin, Burton, Anoka, Bobcat State
Wildlife Management Area, Twin Lakes State Wildlife Management Area,
Hull Lake State Wildlife Management Area, Thomas Creek State Wildlife
Management Area, Mariaville, Pine Glen State Wildlife Refuge, and
Antelope Peak.

This includes the following highways...
Highway 183 between mile markers 163 and 223.
Highway 20 between mile markers 226 and 288.
Highway 281 between mile markers 214 and 223.
Highway 12 near mile marker 40, and between mile markers 44 and 123.","For your protection move to an interior room on the lowest floor of a
building.",2025-08-14 04:05:00+00:00,2025-08-14 04:05:00+00:00,2025-08-14 04:15:00+00:00,Actual,Update,NWS North Platte NE,http://www.weather.gov,Polygon
urn:oid:2.49.0.1.840.0.2afd9443c32fc29234a2990cb1fada1124aa4696.001.1,Upper Snake River Valley/Idaho Falls BLM; Centennial Mountains and Snake River Range/Targhee NF; East Salmon River Mountains/Salmon NF; Lemhi and Lost River Range/Challis NF,Red Flag Warning,Severe,Likely,Expected,Red Flag Warning issued August 13 at 10:04PM MDT until August 14 at 10:00PM MDT by NWS Pocatello ID,"The National Weather Service in Pocatello has issued a Red Flag
Warning for gusty winds and low relative humidity, which is in
effect from noon to 10 PM MDT Thursday.

* AFFECTED AREA...Fire Weather Zone 410 Upper Snake River
Valley/Idaho Falls BLM, Fire Weather Zone 411 Centennial
Mountains and Snake River Range/Targhee NF, Fire Weather Zone
475 East Salmon River Mountains/Salmon NF and Fire Weather
Zone 476 Lemhi and Lost River Range/Challis NF.

* WINDS...Southwest 15 to 25 mph with gusts up to 35 mph.

* RELATIVE HUMIDITY...As low as 13 percent.

* IMPACTS...The combination of dry fuels, gusty winds, low
humidity and potential for lightning will lead to increasing
fire spread and more extreme fire behavior.","A Red Flag Warning means that critical fire weather conditions
are either occurring now, or will shortly based on these criteria
for Southeastern Idaho:

- Relative humidity at or below 15 percent and wind gusts of at
least 25 mph in the mountains, or 30 mph in the Snake Plain.

- Thunderstorm coverage of 25 percent, without specific rainfall
criteria.

- Other high impact events deemed critical by the National
Weather Service and area fire management agencies.",2025-08-14 04:04:00+00:00,2025-08-14 04:04:00+00:00,2025-08-14 12:00:00+00:00,Actual,Alert,NWS Pocatello ID,http://www.weather.gov,
